{
  "platform_name": "icecube800banw",
  "vendor": "broadcom",
  "asic": "tomahawk6",
  "num_ports_per_core": 2,
  "defaults": {
    "asic_config_params": {
      "config_type": "YAML_CONFIG",
      "exact_match": false,
      "mmu_lossless": false,
      "config_gen_type": "DEFAULT"
    },
    "port_config": {
      "default_speed": 800000,
      "speed_to_fec": {
        "100000": "PC_FEC_RS544_2XN",
        "200000": "PC_FEC_RS544_2XN_IEEE",
        "400000": "PC_FEC_RS544_2XN_IEEE",
        "800000": "PC_FEC_RS544_2XN_IEEE"
      }
    },
    "cpu_port": {
      "speed": 10000,
      "num_lanes": 1
    },
    "mgmt_port": {
      "enabled": true
    },
    "mgmt_port_overrides": {
      "logical_id": 268,
      "physical_id": 514
    },
    "port_mapping_overrides": {
      "num_logical_ports_per_datapath": 16,
      "lp_start_step_offset": 2,
      "lp_offset_simple": true
    },
    "platform_sai_overrides": {
      "l3_ecmp_member_secondary_mem_size": "8192",
      "sai_port_phy_time_sync_en": "0",
      "sai_eapol_trap_use_bcast_mac": "1",
      "sai_stats_disable_mask": "0x800"
    },
    "features": {
      "generate_autoload_board_settings": true
    },
    "conditional_settings": [
      {
        "name": "prod_stat_custom_receive0",
        "description": "Emits stat_custom_receive0_management_mode when running with the DEFAULT generation profile.",
        "condition": {
          "source": "asic_config_params",
          "param": "config_gen_type",
          "equals": "DEFAULT"
        },
        "apply": {
          "global": {
            "stat_custom_receive0_management_mode": 1
          }
        }
      }
    ]
  },
  "variants": {
    "default": {}
  }
}
