{
  "platform_name": "montblanc",
  "vendor": "broadcom",
  "asic": "tomahawk5",
  "num_ports_per_core": 2,
  "defaults": {
    "asic_config_params": {
      "config_type": "YAML_CONFIG",
      "exact_match": false,
      "mmu_lossless": false,
      "config_gen_type": "DEFAULT"
    },
    "port_config": {
      "default_speed": 400000,
      "speed_to_fec": {
        "100000": "PC_FEC_RS544",
        "200000": "PC_FEC_RS544_2XN",
        "400000": "PC_FEC_RS544_2XN",
        "800000": "PC_FEC_RS544_2XN"
      }
    },
    "cpu_port": {
      "speed": 10000,
      "num_lanes": 1
    },
    "mgmt_port": {
      "enabled": true,
      "speed_variants": {
        "100000": {
          "num_lanes": 4,
          "fec": "PC_FEC_RS528"
        },
        "10000": {
          "num_lanes": 1,
          "fec": "PC_FEC_NONE",
          "pmd_firmware": {
            "MEDIUM_TYPE_AUTO": 0,
            "MEDIUM_TYPE": "PC_PHY_MEDIUM_COPPER"
          }
        }
      }
    },
    "device_config_overrides": {
      "CORE_CLK_FREQ": "CLK_1125MHZ",
      "PP_CLK_FREQ": "CLK_675MHZ"
    },
    "features": {
      "generate_dlb_config": true,
      "generate_low_clock_freq_settings": true,
      "generate_autoload_board_settings": true
    },
    "conditional_settings": [
      {
        "name": "large_ecmp_member_capacity",
        "description": "Expands the secondary ECMP member table for workloads requiring additional ECMP member capacity.",
        "condition": {
          "source": "features",
          "param": "enable_large_ecmp_member_capacity",
          "equals": true
        },
        "apply": {
          "global": {
            "l3_ecmp_member_secondary_mem_size": "16384"
          }
        }
      }
    ]
  },
  "variants": {
    "default": {},
    "hw_test": {
      "asic_config_params": {
        "config_gen_type": "HW_TEST"
      },
      "features": {
        "enable_sai_managed_udf_groups": true,
        "enable_large_ecmp_member_capacity": true
      }
    }
  }
}
