{
  "platform_name": "wedge800bact",
  "vendor": "broadcom",
  "asic": "tomahawk5",
  "num_ports_per_core": 1,
  "defaults": {
    "asic_config_params": {
      "config_type": "YAML_CONFIG",
      "exact_match": false,
      "mmu_lossless": false,
      "config_gen_type": "DEFAULT"
    },
    "port_config": {
      "default_speed": 800000,
      "speed_to_fec": {
        "100000": "PC_FEC_RS544",
        "200000": "PC_FEC_RS544_2XN",
        "400000": "PC_FEC_RS544_2XN",
        "800000": "PC_FEC_RS544_2XN"
      }
    },
    "cpu_port": {
      "speed": 10000,
      "num_lanes": 1
    },
    "mgmt_port": {
      "enabled": true,
      "speed_variants": {
        "100000": {
          "num_lanes": 4,
          "fec": "PC_FEC_RS528"
        },
        "10000": {
          "num_lanes": 1,
          "fec": "PC_FEC_NONE",
          "pmd_firmware": {
            "MEDIUM_TYPE_AUTO": 0,
            "MEDIUM_TYPE": "PC_PHY_MEDIUM_COPPER"
          }
        }
      }
    },
    "port_mapping_overrides": {
      "core_range": "0-15,48-63",
      "num_lp_ports_on_even_core": 4
    },
    "platform_sai_overrides": {
      "sai_eapol_trap_use_bcast_mac": "1"
    },
    "features": {
      "generate_dlb_config": true,
      "generate_low_clock_freq_settings": false,
      "generate_autoload_board_settings": true
    }
  },
  "variants": {
    "default": {},
    "hw_test": {
      "asic_config_params": {
        "config_gen_type": "HW_TEST"
      },
      "features": {
        "enable_sai_managed_udf_groups": true
      }
    }
  }
}
