{
  "platform_name": "tahan800bc",
  "vendor": "broadcom",
  "asic": "tomahawk5",
  "num_ports_per_core": 1,
  "defaults": {
    "asic_config_params": {
      "config_type": "YAML_CONFIG",
      "exact_match": false,
      "mmu_lossless": false,
      "config_gen_type": "DEFAULT"
    },
    "port_config": {
      "default_speed": 800000,
      "speed_to_fec": {
        "100000": "PC_FEC_RS544_2XN",
        "800000": "PC_FEC_RS544_2XN"
      }
    },
    "cpu_port": {
      "speed": 10000,
      "num_lanes": 1
    },
    "mgmt_port": {
      "enabled": true
    },
    "features": {
      "generate_dlb_config": true,
      "generate_autoload_board_settings": true
    }
  },
  "variants": {
    "chassis": {
      "platform_mapping_name": "tahan800bc_chassis"
    },
    "test_fixture": {
      "platform_mapping_name": "tahan800bc_test_fixture"
    }
  }
}
